{"$schema":"https://json-schema.org/draft/2020-12/schema","type":"object","additionalProperties":false,"required":["schema_version","registry_version","criteria","evidence"],"properties":{"schema_version":{"const":1},"registry_version":{"type":"string"},"criteria":{"type":"array","items":{"type":"object","additionalProperties":false,"required":["id","package","description","evidence_id"],"properties":{"id":{"type":"string"},"package":{"type":"string"},"description":{"type":"string"},"evidence_id":{"type":"string"}}}},"evidence":{"type":"array","items":{"type":"object","additionalProperties":false,"required":["id","package","type","ref","criteria_marker","content_sha256"],"properties":{"id":{"type":"string"},"package":{"type":"string"},"type":{"const":"PYTEST_NODE"},"ref":{"type":"string"},"criteria_marker":{"const":"governance_acceptance"},"content_sha256":{"type":"string","pattern":"^[0-9a-f]{64}$"}}}}}}
